[
  {
    "id": "research-support-sodomaco2026atomistic",
    "title": "Atomistic QM/Classical Modeling of Surface-Enhanced Infrared Absorption",
    "creator": [
      {
        "name": "Sveva Sodomaco",
        "role": "author",
        "family": "Sodomaco",
        "given": "Sveva"
      },
      {
        "name": "Piero Lafiosca",
        "role": "author",
        "family": "Lafiosca",
        "given": "Piero"
      },
      {
        "name": "Tommaso Giovannini",
        "role": "author",
        "family": "Giovannini",
        "given": "Tommaso"
      },
      {
        "name": "Chiara Cappelli",
        "role": "author",
        "family": "Cappelli",
        "given": "Chiara"
      }
    ],
    "year": 2026,
    "date": "2026-01-22",
    "language": [],
    "type": "article",
    "typeLabel": "Journal article",
    "description": "Journal article published in The Journal of Physical Chemistry C.",
    "identifier": {
      "doi": "10.1021/acs.jpcc.5c07549",
      "pmid": "",
      "url": "https://doi.org/10.1021/acs.jpcc.5c07549"
    },
    "source": {
      "containerTitle": "The Journal of Physical Chemistry C",
      "volume": "130",
      "issue": "5",
      "pages": "1919–1930",
      "archive": "",
      "archiveLocation": "sodomaco2026atomistic"
    },
    "keywords": [
      "research-support",
      "bibtex-import",
      "article",
      "the-journal-of-physical-chemistry-c"
    ]
  },
  {
    "id": "research-support-grobasillobre2026electric",
    "title": "Electric Field Enhancements and Hot Spots in Amorphous Carbon Materials",
    "creator": [
      {
        "name": "Pablo Grobas Illobre",
        "role": "author",
        "family": "Grobas Illobre",
        "given": "Pablo"
      },
      {
        "name": "Giorgio Conter",
        "role": "author",
        "family": "Conter",
        "given": "Giorgio"
      },
      {
        "name": "Luca Bonatti",
        "role": "author",
        "family": "Bonatti",
        "given": "Luca"
      },
      {
        "name": "Tommaso Giovannini",
        "role": "author",
        "family": "Giovannini",
        "given": "Tommaso"
      },
      {
        "name": "Alessandro Fortunelli",
        "role": "author",
        "family": "Fortunelli",
        "given": "Alessandro"
      },
      {
        "name": "Chiara Cappelli",
        "role": "author",
        "family": "Cappelli",
        "given": "Chiara"
      }
    ],
    "year": 2026,
    "date": "2026",
    "language": [],
    "type": "article",
    "typeLabel": "Journal article",
    "description": "Journal article published in Small Structures.",
    "identifier": {
      "doi": "10.1002/sstr.202500733",
      "pmid": "",
      "url": "https://doi.org/10.1002/sstr.202500733"
    },
    "source": {
      "containerTitle": "Small Structures",
      "volume": "7",
      "issue": "3",
      "pages": "e202500733",
      "archive": "",
      "archiveLocation": "grobasillobre2026electric"
    },
    "keywords": [
      "research-support",
      "bibtex-import",
      "article",
      "small-structures"
    ]
  },
  {
    "id": "research-support-scholtz2025tentative",
    "title": "Tentative rotation in a galaxy at z ∼ 14 with ALMA",
    "creator": [
      {
        "name": "J. Scholtz",
        "role": "author",
        "family": "Scholtz",
        "given": "J."
      },
      {
        "name": "E. Parlanti",
        "role": "author",
        "family": "Parlanti",
        "given": "E."
      },
      {
        "name": "S. Carniani",
        "role": "author",
        "family": "Carniani",
        "given": "S."
      },
      {
        "name": "M. Kohandel",
        "role": "author",
        "family": "Kohandel",
        "given": "M."
      },
      {
        "name": "F. Sun",
        "role": "author",
        "family": "Sun",
        "given": "F."
      },
      {
        "name": "A. L. Danhaive",
        "role": "author",
        "family": "Danhaive",
        "given": "A. L."
      },
      {
        "name": "R. Maiolino",
        "role": "author",
        "family": "Maiolino",
        "given": "R."
      },
      {
        "name": "S. Arribas",
        "role": "author",
        "family": "Arribas",
        "given": "S."
      },
      {
        "name": "R. Bhatawdekar",
        "role": "author",
        "family": "Bhatawdekar",
        "given": "R."
      },
      {
        "name": "A. J. Bunker",
        "role": "author",
        "family": "Bunker",
        "given": "A. J."
      },
      {
        "name": "S. Charlot",
        "role": "author",
        "family": "Charlot",
        "given": "S."
      },
      {
        "name": "F. D’Eugenio",
        "role": "author",
        "family": "D’Eugenio",
        "given": "F."
      },
      {
        "name": "A. Ferrara",
        "role": "author",
        "family": "Ferrara",
        "given": "A."
      },
      {
        "name": "Z. Ji",
        "role": "author",
        "family": "Ji",
        "given": "Z."
      },
      {
        "name": "Gareth C. Jones",
        "role": "author",
        "family": "Jones",
        "given": "Gareth C."
      },
      {
        "name": "P. Rinaldi",
        "role": "author",
        "family": "Rinaldi",
        "given": "P."
      },
      {
        "name": "B. E. Robertson",
        "role": "author",
        "family": "Robertson",
        "given": "B. E."
      },
      {
        "name": "A. Pallottini",
        "role": "author",
        "family": "Pallottini",
        "given": "A."
      },
      {
        "name": "I. Shivaei",
        "role": "author",
        "family": "Shivaei",
        "given": "I."
      },
      {
        "name": "Y. Sun",
        "role": "author",
        "family": "Sun",
        "given": "Y."
      },
      {
        "name": "S. Tacchella",
        "role": "author",
        "family": "Tacchella",
        "given": "S."
      },
      {
        "name": "H. Übler",
        "role": "author",
        "family": "Übler",
        "given": "H."
      },
      {
        "name": "G. Venturi",
        "role": "author",
        "family": "Venturi",
        "given": "G."
      }
    ],
    "year": 2025,
    "date": "2025-10-27",
    "language": [],
    "type": "article",
    "typeLabel": "Journal article",
    "description": "Journal article published in Monthly Notices of the Royal Astronomical Society: Letters.",
    "identifier": {
      "doi": "10.1093/mnrasl/slaf109",
      "pmid": "",
      "url": "https://doi.org/10.1093/mnrasl/slaf109"
    },
    "source": {
      "containerTitle": "Monthly Notices of the Royal Astronomical Society: Letters",
      "volume": "544",
      "issue": "1",
      "pages": "L113–L120",
      "archive": "",
      "archiveLocation": "scholtz2025tentative"
    },
    "keywords": [
      "research-support",
      "bibtex-import",
      "article",
      "monthly-notices-of-the-royal-astronomical-society-letters"
    ]
  },
  {
    "id": "research-support-breitman2025sample",
    "title": "Sample variance denoising in cylindrical 21 cm power spectra",
    "creator": [
      {
        "name": "D. Breitman",
        "role": "author",
        "family": "Breitman",
        "given": "D."
      },
      {
        "name": "A. Mesinger",
        "role": "author",
        "family": "Mesinger",
        "given": "A."
      },
      {
        "name": "S. G. Murray",
        "role": "author",
        "family": "Murray",
        "given": "S. G."
      },
      {
        "name": "A. Acharya",
        "role": "author",
        "family": "Acharya",
        "given": "A."
      }
    ],
    "year": 2025,
    "date": "2025",
    "language": [],
    "type": "article",
    "typeLabel": "Journal article",
    "description": "Journal article published in Astronomy & Astrophysics.",
    "identifier": {
      "doi": "10.1051/0004-6361/202556449",
      "pmid": "",
      "url": "https://doi.org/10.1051/0004-6361/202556449"
    },
    "source": {
      "containerTitle": "Astronomy & Astrophysics",
      "volume": "703",
      "issue": "",
      "pages": "A130",
      "archive": "",
      "archiveLocation": "breitman2025sample"
    },
    "keywords": [
      "research-support",
      "bibtex-import",
      "article",
      "astronomy-astrophysics"
    ]
  },
  {
    "id": "research-support-nikolic2025mapping",
    "title": "Mapping reionization bubbles in JWST era - II. Inferring the position and characteristic size of individual bubbles",
    "creator": [
      {
        "name": "I. Nikolić",
        "role": "author",
        "family": "Nikolić",
        "given": "I."
      },
      {
        "name": "A. Mesinger",
        "role": "author",
        "family": "Mesinger",
        "given": "A."
      },
      {
        "name": "C. A. Mason",
        "role": "author",
        "family": "Mason",
        "given": "C. A."
      },
      {
        "name": "T.-Y. Lu",
        "role": "author",
        "family": "Lu",
        "given": "T.-Y."
      },
      {
        "name": "M. Tang",
        "role": "author",
        "family": "Tang",
        "given": "M."
      },
      {
        "name": "D. Prelogović",
        "role": "author",
        "family": "Prelogović",
        "given": "D."
      },
      {
        "name": "S. Gagnon-Hartman",
        "role": "author",
        "family": "Gagnon-Hartman",
        "given": "S."
      },
      {
        "name": "D. P. Stark",
        "role": "author",
        "family": "Stark",
        "given": "D. P."
      }
    ],
    "year": 2025,
    "date": "2025",
    "language": [],
    "type": "article",
    "typeLabel": "Journal article",
    "description": "Journal article published in Astronomy & Astrophysics.",
    "identifier": {
      "doi": "10.1051/0004-6361/202553756",
      "pmid": "",
      "url": "https://doi.org/10.1051/0004-6361/202553756"
    },
    "source": {
      "containerTitle": "Astronomy & Astrophysics",
      "volume": "699",
      "issue": "",
      "pages": "A323",
      "archive": "",
      "archiveLocation": "nikolic2025mapping"
    },